{
  "version": 1,
  "empreinte_donnees": "c311a62b83d6096affbfdfab73633c8552648305dce79dc07f18a8446f3ef6e4",
  "provisoire": true,
  "questions_actives": 206,
  "seuil_evalue": 0.4,
  "candidats": {
    "arthaud-nathalie": {
      "vague": 1,
      "statut_evaluation": "codage_en_attente",
      "positions_disponibles": true,
      "questions_avec_position": 19,
      "avec_extrait": 7,
      "codes_publies": 7,
      "arbitrages_en_attente": 0,
      "non_connu_apres_accord": 0,
      "taux_couverture": 0.033981,
      "seuil_evalue_atteint": false,
      "natures": {
        "nette": 3,
        "nuancee": 4,
        "imprecise": 0
      },
      "parts_natures": {
        "nette": 0.428571,
        "nuancee": 0.571429,
        "imprecise": 0
      },
      "par_theme": {
        "defense": {
          "questions_actives": 14,
          "codes_publies": 0,
          "taux_couverture": 0
        },
        "ecologie-energie": {
          "questions_actives": 23,
          "codes_publies": 0,
          "taux_couverture": 0
        },
        "economie-dette": {
          "questions_actives": 20,
          "codes_publies": 0,
          "taux_couverture": 0
        },
        "education": {
          "questions_actives": 18,
          "codes_publies": 0,
          "taux_couverture": 0
        },
        "fiscalite": {
          "questions_actives": 19,
          "codes_publies": 0,
          "taux_couverture": 0
        },
        "immigration": {
          "questions_actives": 21,
          "codes_publies": 0,
          "taux_couverture": 0
        },
        "institutions": {
          "questions_actives": 18,
          "codes_publies": 0,
          "taux_couverture": 0
        },
        "retraites": {
          "questions_actives": 19,
          "codes_publies": 7,
          "taux_couverture": 0.368421
        },
        "sante": {
          "questions_actives": 19,
          "codes_publies": 0,
          "taux_couverture": 0
        },
        "securite": {
          "questions_actives": 20,
          "codes_publies": 0,
          "taux_couverture": 0
        },
        "union-europeenne": {
          "questions_actives": 15,
          "codes_publies": 0,
          "taux_couverture": 0
        }
      }
    },
    "asselineau-francois": {
      "vague": 2,
      "statut_evaluation": "codage_en_attente",
      "positions_disponibles": false,
      "questions_avec_position": 0,
      "avec_extrait": 0,
      "codes_publies": 0,
      "arbitrages_en_attente": 0,
      "non_connu_apres_accord": 0,
      "taux_couverture": 0,
      "seuil_evalue_atteint": false,
      "natures": {
        "nette": 0,
        "nuancee": 0,
        "imprecise": 0
      },
      "parts_natures": null,
      "par_theme": {
        "defense": {
          "questions_actives": 14,
          "codes_publies": 0,
          "taux_couverture": 0
        },
        "ecologie-energie": {
          "questions_actives": 23,
          "codes_publies": 0,
          "taux_couverture": 0
        },
        "economie-dette": {
          "questions_actives": 20,
          "codes_publies": 0,
          "taux_couverture": 0
        },
        "education": {
          "questions_actives": 18,
          "codes_publies": 0,
          "taux_couverture": 0
        },
        "fiscalite": {
          "questions_actives": 19,
          "codes_publies": 0,
          "taux_couverture": 0
        },
        "immigration": {
          "questions_actives": 21,
          "codes_publies": 0,
          "taux_couverture": 0
        },
        "institutions": {
          "questions_actives": 18,
          "codes_publies": 0,
          "taux_couverture": 0
        },
        "retraites": {
          "questions_actives": 19,
          "codes_publies": 0,
          "taux_couverture": 0
        },
        "sante": {
          "questions_actives": 19,
          "codes_publies": 0,
          "taux_couverture": 0
        },
        "securite": {
          "questions_actives": 20,
          "codes_publies": 0,
          "taux_couverture": 0
        },
        "union-europeenne": {
          "questions_actives": 15,
          "codes_publies": 0,
          "taux_couverture": 0
        }
      }
    },
    "attal-gabriel": {
      "vague": 1,
      "statut_evaluation": "codage_en_attente",
      "positions_disponibles": true,
      "questions_avec_position": 19,
      "avec_extrait": 6,
      "codes_publies": 6,
      "arbitrages_en_attente": 0,
      "non_connu_apres_accord": 0,
      "taux_couverture": 0.029126,
      "seuil_evalue_atteint": false,
      "natures": {
        "nette": 0,
        "nuancee": 3,
        "imprecise": 3
      },
      "parts_natures": {
        "nette": 0,
        "nuancee": 0.5,
        "imprecise": 0.5
      },
      "par_theme": {
        "defense": {
          "questions_actives": 14,
          "codes_publies": 0,
          "taux_couverture": 0
        },
        "ecologie-energie": {
          "questions_actives": 23,
          "codes_publies": 0,
          "taux_couverture": 0
        },
        "economie-dette": {
          "questions_actives": 20,
          "codes_publies": 0,
          "taux_couverture": 0
        },
        "education": {
          "questions_actives": 18,
          "codes_publies": 0,
          "taux_couverture": 0
        },
        "fiscalite": {
          "questions_actives": 19,
          "codes_publies": 0,
          "taux_couverture": 0
        },
        "immigration": {
          "questions_actives": 21,
          "codes_publies": 0,
          "taux_couverture": 0
        },
        "institutions": {
          "questions_actives": 18,
          "codes_publies": 0,
          "taux_couverture": 0
        },
        "retraites": {
          "questions_actives": 19,
          "codes_publies": 6,
          "taux_couverture": 0.315789
        },
        "sante": {
          "questions_actives": 19,
          "codes_publies": 0,
          "taux_couverture": 0
        },
        "securite": {
          "questions_actives": 20,
          "codes_publies": 0,
          "taux_couverture": 0
        },
        "union-europeenne": {
          "questions_actives": 15,
          "codes_publies": 0,
          "taux_couverture": 0
        }
      }
    },
    "batho-delphine": {
      "vague": 2,
      "statut_evaluation": "codage_en_attente",
      "positions_disponibles": false,
      "questions_avec_position": 0,
      "avec_extrait": 0,
      "codes_publies": 0,
      "arbitrages_en_attente": 0,
      "non_connu_apres_accord": 0,
      "taux_couverture": 0,
      "seuil_evalue_atteint": false,
      "natures": {
        "nette": 0,
        "nuancee": 0,
        "imprecise": 0
      },
      "parts_natures": null,
      "par_theme": {
        "defense": {
          "questions_actives": 14,
          "codes_publies": 0,
          "taux_couverture": 0
        },
        "ecologie-energie": {
          "questions_actives": 23,
          "codes_publies": 0,
          "taux_couverture": 0
        },
        "economie-dette": {
          "questions_actives": 20,
          "codes_publies": 0,
          "taux_couverture": 0
        },
        "education": {
          "questions_actives": 18,
          "codes_publies": 0,
          "taux_couverture": 0
        },
        "fiscalite": {
          "questions_actives": 19,
          "codes_publies": 0,
          "taux_couverture": 0
        },
        "immigration": {
          "questions_actives": 21,
          "codes_publies": 0,
          "taux_couverture": 0
        },
        "institutions": {
          "questions_actives": 18,
          "codes_publies": 0,
          "taux_couverture": 0
        },
        "retraites": {
          "questions_actives": 19,
          "codes_publies": 0,
          "taux_couverture": 0
        },
        "sante": {
          "questions_actives": 19,
          "codes_publies": 0,
          "taux_couverture": 0
        },
        "securite": {
          "questions_actives": 20,
          "codes_publies": 0,
          "taux_couverture": 0
        },
        "union-europeenne": {
          "questions_actives": 15,
          "codes_publies": 0,
          "taux_couverture": 0
        }
      }
    },
    "becht-olivier": {
      "vague": 2,
      "statut_evaluation": "codage_en_attente",
      "positions_disponibles": false,
      "questions_avec_position": 0,
      "avec_extrait": 0,
      "codes_publies": 0,
      "arbitrages_en_attente": 0,
      "non_connu_apres_accord": 0,
      "taux_couverture": 0,
      "seuil_evalue_atteint": false,
      "natures": {
        "nette": 0,
        "nuancee": 0,
        "imprecise": 0
      },
      "parts_natures": null,
      "par_theme": {
        "defense": {
          "questions_actives": 14,
          "codes_publies": 0,
          "taux_couverture": 0
        },
        "ecologie-energie": {
          "questions_actives": 23,
          "codes_publies": 0,
          "taux_couverture": 0
        },
        "economie-dette": {
          "questions_actives": 20,
          "codes_publies": 0,
          "taux_couverture": 0
        },
        "education": {
          "questions_actives": 18,
          "codes_publies": 0,
          "taux_couverture": 0
        },
        "fiscalite": {
          "questions_actives": 19,
          "codes_publies": 0,
          "taux_couverture": 0
        },
        "immigration": {
          "questions_actives": 21,
          "codes_publies": 0,
          "taux_couverture": 0
        },
        "institutions": {
          "questions_actives": 18,
          "codes_publies": 0,
          "taux_couverture": 0
        },
        "retraites": {
          "questions_actives": 19,
          "codes_publies": 0,
          "taux_couverture": 0
        },
        "sante": {
          "questions_actives": 19,
          "codes_publies": 0,
          "taux_couverture": 0
        },
        "securite": {
          "questions_actives": 20,
          "codes_publies": 0,
          "taux_couverture": 0